{
  "version": "0.1",
  "id": "pharma_project_equipment_reconstruction",
  "revision": "R01",
  "sources": [
    {
      "id": "project",
      "kind": "cad_geometry",
      "title": "Project-authored equipment reconstruction example",
      "edition": "Example R01",
      "uri": "urn:layout-configurator:example:equipment:R01",
      "locator": "Structured equipment, dimensions, envelopes, points, actions and finite template",
      "content": "{\n  \"equipment\": {\n    \"id\": \"production_line_01\",\n    \"type\": \"production_line\",\n    \"width_mm\": 9000.0,\n    \"depth_mm\": 2200.0,\n    \"clearance_front_mm\": 1800.0,\n    \"clearance_back_mm\": 1200.0,\n    \"clearance_left_mm\": 900.0,\n    \"clearance_right_mm\": 900.0,\n    \"rotation_allowed\": false,\n    \"fixed\": true,\n    \"anchor_offset_mm\": 1000.0,\n    \"room_id\": \"production\",\n    \"anchor_side\": \"top\"\n  },\n  \"dimensions\": {\n    \"width_mm\": {\n      \"value\": 9000.0,\n      \"unit\": \"mm\"\n    },\n    \"depth_mm\": {\n      \"value\": 2200.0,\n      \"unit\": \"mm\"\n    },\n    \"clearance_front_mm\": {\n      \"value\": 1800.0,\n      \"unit\": \"mm\"\n    },\n    \"clearance_back_mm\": {\n      \"value\": 1200.0,\n      \"unit\": \"mm\"\n    },\n    \"clearance_left_mm\": {\n      \"value\": 900.0,\n      \"unit\": \"mm\"\n    },\n    \"clearance_right_mm\": {\n      \"value\": 900.0,\n      \"unit\": \"mm\"\n    }\n  },\n  \"envelopes\": {\n    \"body\": {\n      \"kind\": \"rectangle\",\n      \"unit\": \"mm\",\n      \"x\": 0.0,\n      \"y\": 0.0,\n      \"width\": 9000.0,\n      \"depth\": 2200.0,\n      \"id\": \"body\",\n      \"scenario\": \"all\",\n      \"role\": \"body\",\n      \"required_action_ids\": []\n    },\n    \"operating\": {\n      \"kind\": \"rectangle\",\n      \"unit\": \"mm\",\n      \"x\": -150.0,\n      \"y\": -100.0,\n      \"width\": 9350.0,\n      \"depth\": 2600.0,\n      \"id\": \"operating\",\n      \"scenario\": \"production\",\n      \"role\": \"operating\",\n      \"required_action_ids\": []\n    },\n    \"service\": {\n      \"kind\": \"rectangle\",\n      \"unit\": \"mm\",\n      \"x\": -400.0,\n      \"y\": -200.0,\n      \"width\": 9800.0,\n      \"depth\": 2900.0,\n      \"id\": \"service\",\n      \"scenario\": \"maintenance\",\n      \"role\": \"service\",\n      \"required_action_ids\": []\n    },\n    \"panel\": {\n      \"kind\": \"orthogonal_polygon\",\n      \"unit\": \"mm\",\n      \"points\": [\n        [\n          -400,\n          0\n        ],\n        [\n          -100,\n          0\n        ],\n        [\n          -100,\n          300\n        ],\n        [\n          0,\n          300\n        ],\n        [\n          0,\n          600\n        ],\n        [\n          -400,\n          600\n        ],\n        [\n          -400,\n          0\n        ]\n      ],\n      \"id\": \"panel\",\n      \"scenario\": \"maintenance\",\n      \"role\": \"panel\",\n      \"required_action_ids\": [\n        \"stop\"\n      ]\n    },\n    \"tool_removal\": {\n      \"kind\": \"rectangle\",\n      \"unit\": \"mm\",\n      \"x\": 0,\n      \"y\": -500,\n      \"width\": 9000.0,\n      \"depth\": 500,\n      \"id\": \"tool_removal\",\n      \"scenario\": \"maintenance\",\n      \"role\": \"tool_removal\",\n      \"required_action_ids\": []\n    },\n    \"installation\": {\n      \"kind\": \"rectangle\",\n      \"unit\": \"mm\",\n      \"x\": -1000,\n      \"y\": -1000,\n      \"width\": 11000.0,\n      \"depth\": 4200.0,\n      \"id\": \"installation\",\n      \"scenario\": \"installation_replacement\",\n      \"role\": \"installation\",\n      \"required_action_ids\": [\n        \"temporary\"\n      ]\n    }\n  },\n  \"points\": {\n    \"loading\": {\n      \"kind\": \"point\",\n      \"unit\": \"mm\",\n      \"x\": 4500.0,\n      \"y\": 2200.0,\n      \"direction\": \"front\",\n      \"id\": \"loading\",\n      \"scenario\": \"production\",\n      \"role\": \"loading\"\n    },\n    \"unloading\": {\n      \"kind\": \"point\",\n      \"unit\": \"mm\",\n      \"x\": 4500.0,\n      \"y\": 2200.0,\n      \"direction\": \"front\",\n      \"id\": \"unloading\",\n      \"scenario\": \"production\",\n      \"role\": \"unloading\"\n    },\n    \"operator\": {\n      \"kind\": \"point\",\n      \"unit\": \"mm\",\n      \"x\": 4500.0,\n      \"y\": 2200.0,\n      \"direction\": \"front\",\n      \"id\": \"operator\",\n      \"scenario\": \"production\",\n      \"role\": \"operator\"\n    },\n    \"service\": {\n      \"kind\": \"point\",\n      \"unit\": \"mm\",\n      \"x\": 4500.0,\n      \"y\": 2200.0,\n      \"direction\": \"front\",\n      \"id\": \"service\",\n      \"scenario\": \"maintenance\",\n      \"role\": \"service\"\n    },\n    \"connection\": {\n      \"kind\": \"point\",\n      \"unit\": \"mm\",\n      \"x\": 4500.0,\n      \"y\": 2200.0,\n      \"direction\": \"front\",\n      \"id\": \"connection\",\n      \"scenario\": \"production\",\n      \"role\": \"connection\"\n    }\n  },\n  \"actions\": {\n    \"stop\": {\n      \"kind\": \"production_stopped\",\n      \"description\": \"Declared stop for panel access.\",\n      \"id\": \"stop\",\n      \"scenario\": \"maintenance\"\n    },\n    \"temporary\": {\n      \"kind\": \"temporary_action\",\n      \"description\": \"Declared temporary lifting area.\",\n      \"id\": \"temporary\",\n      \"scenario\": \"installation_replacement\"\n    }\n  },\n  \"templates\": {\n    \"press_template\": {\n      \"capability\": \"finite_variant_selection_v1\",\n      \"parameters\": {\n        \"width\": {\n          \"minimum\": {\n            \"value\": 9000.0,\n            \"unit\": \"mm\"\n          },\n          \"maximum\": {\n            \"value\": 10000.0,\n            \"unit\": \"mm\"\n          },\n          \"dimension\": \"width_mm\"\n        }\n      },\n      \"variants\": [\n        {\n          \"id\": \"original\",\n          \"parameters\": {\n            \"width\": 9000.0\n          },\n          \"card_id\": \"press_card\"\n        }\n      ]\n    }\n  },\n  \"classification\": \"Reconstruction from canonical pharma_cleanroom_pilot.yaml production_line_01. Equipment dimensions reproduce that project program. Extra envelopes, named points and scenario actions are authored solely for this example; they are not manufacturer specifications or legal clearance requirements. Height, physical scenario feasibility, safety and 3D installation routes remain UNKNOWN.\"\n}\r\n",
      "sha256": "1907026d4ab8f4331cb6c6e02158b4e751ab6fd1cc4476048bfa8d87bfb5853e",
      "usage_rights": {
        "state": "PERMITTED",
        "note": "Project-authored example data; permission declaration does not authenticate external manufacturer rights."
      }
    }
  ],
  "cards": [
    {
      "id": "press_card",
      "revision": "R01",
      "label": "Production line project reconstruction",
      "equipment_type": "production_line",
      "origin": "reconstruction",
      "equipment_binding": {
        "id": "production_line_01",
        "sha256": "cea0b2ee2c2a950768dcb356e3eec72a4b62a42c77280168d67b83dcca195a71",
        "source_id": "project",
        "source_pointer": "/equipment"
      },
      "dimensions": {
        "width_mm": {
          "measurement": {
            "status": "KNOWN",
            "value": 9000.0,
            "unit": "mm",
            "basis": "declared_fact",
            "source_id": "project",
            "note": "Supplied project dimension."
          },
          "source_pointer": "/dimensions/width_mm"
        },
        "depth_mm": {
          "measurement": {
            "status": "KNOWN",
            "value": 2200.0,
            "unit": "mm",
            "basis": "declared_fact",
            "source_id": "project",
            "note": "Supplied project dimension."
          },
          "source_pointer": "/dimensions/depth_mm"
        },
        "clearance_front_mm": {
          "measurement": {
            "status": "KNOWN",
            "value": 1800.0,
            "unit": "mm",
            "basis": "declared_fact",
            "source_id": "project",
            "note": "Supplied project dimension."
          },
          "source_pointer": "/dimensions/clearance_front_mm"
        },
        "clearance_back_mm": {
          "measurement": {
            "status": "KNOWN",
            "value": 1200.0,
            "unit": "mm",
            "basis": "declared_fact",
            "source_id": "project",
            "note": "Supplied project dimension."
          },
          "source_pointer": "/dimensions/clearance_back_mm"
        },
        "clearance_left_mm": {
          "measurement": {
            "status": "KNOWN",
            "value": 900.0,
            "unit": "mm",
            "basis": "declared_fact",
            "source_id": "project",
            "note": "Supplied project dimension."
          },
          "source_pointer": "/dimensions/clearance_left_mm"
        },
        "clearance_right_mm": {
          "measurement": {
            "status": "KNOWN",
            "value": 900.0,
            "unit": "mm",
            "basis": "declared_fact",
            "source_id": "project",
            "note": "Supplied project dimension."
          },
          "source_pointer": "/dimensions/clearance_right_mm"
        },
        "height_mm": {
          "measurement": {
            "status": "UNKNOWN",
            "value": null,
            "unit": "mm",
            "basis": "declared_fact",
            "source_id": null,
            "note": "No height supplied."
          },
          "source_pointer": null
        }
      },
      "envelopes": [
        {
          "id": "body",
          "role": "body",
          "scenario": "all",
          "evidence": {
            "status": "KNOWN",
            "basis": "declared_fact",
            "source_id": "project",
            "source_pointer": "/envelopes/body",
            "value": {
              "kind": "rectangle",
              "unit": "mm",